{
  "$schema": "https://json-schema.org/draft/2020-12/schema",
  "$id": "https://yomineko.dev/contracts/speak_unit.schema.json",
  "title": "speak_unit",
  "description": "One unit of the speaking path: phrases, drills and a checkpoint for a single situation.",
  "x-yomineko": {
    "entity": "speak_unit",
    "records": 72,
    "packing": "single",
    "glob": "course/speak/*/unit-*.json",
    "stable_id_field": "id",
    "generated_by": "scripts/contracts/build_schemas.py from contracts/_shapes.json",
    "vocabulary_policy": "Types, nesting and `required` are measured from the data. Value sets are not: every `enum` here is either declared in a design document, parsed from the code that produces the value, or curated in build_schemas.py with its source named in x-vocabulary. See contracts/README.md."
  },
  "type": "object",
  "properties": {
    "audio": {
      "type": "string",
      "pattern": "^(pending|[A-Za-z0-9_./-]+\\.(mp3|m4a|ogg|wav|opus))$",
      "description": "The audio asset, or the literal `pending` while the TTS pipeline (design/listening.md) has not produced it yet. The first real filename must not fail the build."
    },
    "checkpoint": {
      "type": "array",
      "items": {
        "type": "object",
        "properties": {
          "distractors": {
            "type": "array",
            "items": {
              "type": "string"
            },
            "minItems": 2,
            "uniqueItems": true
          },
          "id": {
            "$ref": "common.schema.json#/$defs/StableId"
          },
          "type": {
            "type": "string",
            "enum": [
              "context_fill",
              "grammar_form",
              "kanji_reading",
              "orthography",
              "paraphrase",
              "reading_comp",
              "sentence_order",
              "text_grammar",
              "usage"
            ],
            "description": "Which exam section this item is drawn from. Vocabulary owner: design — design/exam_simulator.md (the written-section table). Widening it is an edit there, never a side effect of regenerating this schema from the data.",
            "x-vocabulary": {
              "owner": "design",
              "source": "design/exam_simulator.md (the written-section table)"
            }
          },
          "via": {
            "type": "string",
            "enum": [
              "new-word",
              "phrase",
              "review"
            ],
            "description": "Why this checkpoint item is in this unit. Vocabulary owner: producer — scripts/export/build_speaking_checkpoints.py (how the item was selected for this unit). Widening it is an edit there, never a side effect of regenerating this schema from the data.",
            "x-vocabulary": {
              "owner": "producer",
              "source": "scripts/export/build_speaking_checkpoints.py (how the item was selected for this unit)"
            }
          }
        },
        "additionalProperties": false
      }
    },
    "chunk_phrases": {
      "type": "array",
      "items": {
        "$ref": "common.schema.json#/$defs/IdRef"
      }
    },
    "cumulative_known_vocab": {
      "type": "integer",
      "minimum": 0
    },
    "drills": {
      "type": "array",
      "items": {
        "type": "object",
        "properties": {
          "examples": {
            "type": "array",
            "items": {
              "type": "string"
            }
          },
          "pattern": {
            "type": "string"
          },
          "strand": {
            "type": "string",
            "enum": [
              "fluency",
              "language-focused",
              "meaning-input",
              "meaning-output"
            ],
            "description": "Which of the four strands this component trains. Vocabulary owner: design — design/learning_science.md R77 (Nation's four strands). Widening it is an edit there, never a side effect of regenerating this schema from the data.",
            "x-vocabulary": {
              "owner": "design",
              "source": "design/learning_science.md R77 (Nation's four strands)"
            }
          }
        },
        "additionalProperties": false
      }
    },
    "fluency": {
      "type": [
        "object",
        "null"
      ],
      "properties": {
        "items": {
          "type": "array",
          "items": {
            "type": "string"
          }
        },
        "kind": {
          "type": "string",
          "enum": [
            "recap",
            "situation"
          ],
          "x-vocabulary": {
            "owner": "measured",
            "source": "contracts/_shapes.json — no design document or producer owns this field, and the observed set is small, closed and free of prose, ids and paths."
          }
        },
        "prompt": {
          "$ref": "common.schema.json#/$defs/LocaleText"
        },
        "seconds_target": {
          "type": "integer",
          "minimum": 0
        },
        "strand": {
          "type": "string",
          "enum": [
            "fluency",
            "language-focused",
            "meaning-input",
            "meaning-output"
          ],
          "description": "Which of the four strands this component trains. Vocabulary owner: design — design/learning_science.md R77 (Nation's four strands). Widening it is an edit there, never a side effect of regenerating this schema from the data.",
          "x-vocabulary": {
            "owner": "design",
            "source": "design/learning_science.md R77 (Nation's four strands)"
          }
        },
        "zero_new_tokens": {
          "type": "boolean"
        }
      },
      "additionalProperties": false
    },
    "id": {
      "$ref": "common.schema.json#/$defs/StableId"
    },
    "kanji_recognition": {
      "type": "array",
      "items": {
        "type": "string"
      }
    },
    "layer": {
      "$ref": "common.schema.json#/$defs/Layer"
    },
    "needs_review": {
      "$ref": "common.schema.json#/$defs/Provenance/properties/needs_review"
    },
    "order": {
      "type": "integer",
      "minimum": 0
    },
    "patterns": {
      "type": "array",
      "items": {
        "type": "string"
      }
    },
    "patterns_chunked": {
      "type": "array",
      "items": {
        "type": "string"
      }
    },
    "production": {
      "type": "array",
      "items": {
        "type": "object",
        "properties": {
          "accepted_variants": {
            "type": "array",
            "items": {
              "type": "string"
            }
          },
          "answer_key": {
            "type": "string"
          },
          "kind": {
            "type": "string",
            "enum": [
              "on-topic",
              "review",
              "same-stage"
            ],
            "x-vocabulary": {
              "owner": "measured",
              "source": "contracts/_shapes.json — no design document or producer owns this field, and the observed set is small, closed and free of prose, ids and paths."
            }
          },
          "prompt": {
            "$ref": "common.schema.json#/$defs/LocaleText"
          },
          "sentence": {
            "type": "string"
          },
          "strand": {
            "type": "string",
            "enum": [
              "fluency",
              "language-focused",
              "meaning-input",
              "meaning-output"
            ],
            "description": "Which of the four strands this component trains. Vocabulary owner: design — design/learning_science.md R77 (Nation's four strands). Widening it is an edit there, never a side effect of regenerating this schema from the data.",
            "x-vocabulary": {
              "owner": "design",
              "source": "design/learning_science.md R77 (Nation's four strands)"
            }
          }
        },
        "additionalProperties": false
      }
    },
    "real_phrases": {
      "type": "integer",
      "minimum": 0
    },
    "review_status": {
      "type": "array",
      "description": "Human review verdicts that are still LIVE for this record: each one's content hash still matches the text it approved. Written by the exporter from research/derived/review_ledger.json, never by hand — an entry whose text was rewritten afterwards is stale and exports nothing, and a review_status the ledger does not justify is a hard failure (scripts/validate/validate_review_ledger.py). Absent on a record nobody has reviewed, which is why it is never required. See design/review_ledger.md.",
      "items": {
        "type": "object",
        "properties": {
          "field": {
            "type": "string",
            "minLength": 1,
            "description": "The reviewed field, or \"*\" for the whole record."
          },
          "locale": {
            "anyOf": [
              {
                "$ref": "common.schema.json#/$defs/Locale"
              },
              {
                "type": "null"
              }
            ],
            "description": "The locale reviewed; null for a locale-agnostic verdict."
          },
          "status": {
            "type": "string",
            "enum": [
              "approved",
              "rejected"
            ],
            "description": "The verdict a named reviewer recorded. Vocabulary owner: design — design/review_ledger.md. Widening it is an edit there, never a side effect of regenerating this schema from the data.",
            "x-vocabulary": {
              "owner": "design",
              "source": "design/review_ledger.md"
            }
          },
          "reviewed_by": {
            "type": "string",
            "minLength": 1,
            "description": "Who reviewed it. An anonymous approval is not a review, and the correction-rate metric is per person."
          },
          "approved_at": {
            "type": "string",
            "minLength": 1,
            "description": "When. Provenance and ordering only — approvals do not expire (APP_PLAN D4): a rewrite invalidates them, the calendar does not."
          },
          "content_hash": {
            "type": "string",
            "pattern": "^(sha256:)?[0-9a-fA-F]{8,64}$",
            "description": "The sha256 of exactly what was reviewed, so a reader can tell WHICH text was approved without the ledger."
          }
        },
        "required": [
          "field",
          "status",
          "reviewed_by",
          "approved_at",
          "content_hash"
        ],
        "additionalProperties": false
      }
    },
    "say_now": {
      "type": "array",
      "items": {
        "type": "string"
      }
    },
    "schema_version": {
      "type": "string",
      "pattern": "^\\d+\\.\\d+$",
      "description": "MAJOR.MINOR of the record format. A version field exists to be bumped; an enum over the current value means it never can be."
    },
    "shadowing": {
      "type": "array",
      "items": {
        "type": "string"
      }
    },
    "srs": {
      "type": "object",
      "properties": {
        "introduces_cards": {
          "type": "array",
          "items": {
            "type": "object",
            "properties": {
              "card_types": {
                "type": "array"
              },
              "deck": {
                "$ref": "common.schema.json#/$defs/IdRef"
              },
              "item": {
                "type": "string"
              }
            }
          }
        }
      },
      "required": [
        "introduces_cards"
      ],
      "additionalProperties": false
    },
    "stage": {
      "$ref": "common.schema.json#/$defs/IdRef"
    },
    "strand_counts": {
      "type": "object",
      "properties": {
        "fluency": {
          "type": "integer",
          "minimum": 0
        },
        "language-focused": {
          "type": "integer",
          "minimum": 0
        },
        "meaning-input": {
          "type": "integer",
          "minimum": 0
        },
        "meaning-output": {
          "type": "integer",
          "minimum": 0
        }
      },
      "required": [
        "fluency",
        "language-focused",
        "meaning-input",
        "meaning-output"
      ],
      "additionalProperties": false
    },
    "strands": {
      "type": "object",
      "properties": {
        "fluency": {
          "type": "integer",
          "minimum": 0
        },
        "language-focused": {
          "type": "integer",
          "minimum": 0
        },
        "meaning-input": {
          "type": "integer",
          "minimum": 0
        },
        "meaning-output": {
          "type": "integer",
          "minimum": 0
        }
      },
      "required": [
        "fluency",
        "language-focused",
        "meaning-input",
        "meaning-output"
      ],
      "additionalProperties": false
    },
    "title": {
      "$ref": "common.schema.json#/$defs/LocaleText"
    },
    "untranslated": {
      "type": "array"
    },
    "words": {
      "type": "array",
      "items": {
        "type": "string"
      }
    }
  },
  "additionalProperties": false,
  "required": [
    "audio",
    "checkpoint",
    "chunk_phrases",
    "cumulative_known_vocab",
    "drills",
    "fluency",
    "id",
    "kanji_recognition",
    "layer",
    "needs_review",
    "order",
    "patterns",
    "patterns_chunked",
    "production",
    "real_phrases",
    "say_now",
    "schema_version",
    "shadowing",
    "srs",
    "stage",
    "strand_counts",
    "strands",
    "title",
    "untranslated",
    "words"
  ]
}
