{
  "id": "speak:eating-06",
  "schema_version": "1.0",
  "stage": "speak:eating",
  "order": 6,
  "title": {
    "pt-BR": "Comer e beber fora, parte 6"
  },
  "say_now": [
    "sent:tatoeba-143649",
    "sent:tatoeba-197249",
    "sent:tatoeba-190536",
    "sent:tatoeba-236798",
    "sent:tatoeba-9936514",
    "sent:tatoeba-179391"
  ],
  "chunk_phrases": [],
  "untranslated": [],
  "words": [
    "vocab:1338240",
    "vocab:1348870",
    "vocab:1163400",
    "vocab:1451150",
    "vocab:1451750",
    "vocab:1215810",
    "vocab:1576250",
    "vocab:1304510",
    "vocab:1245470",
    "vocab:1436050",
    "vocab:1375040",
    "vocab:1371920"
  ],
  "patterns": [
    "gram:gp-149",
    "gram:issho-ni"
  ],
  "kanji_recognition": [
    "出",
    "水",
    "勢",
    "道",
    "残",
    "少"
  ],
  "shadowing": [
    "sent:tatoeba-143649",
    "sent:tatoeba-197249",
    "sent:tatoeba-190536",
    "sent:tatoeba-236798",
    "sent:tatoeba-9936514",
    "sent:tatoeba-179391"
  ],
  "srs": {
    "introduces_cards": [
      {
        "deck": "deck:phrases",
        "item": "sent:tatoeba-143649",
        "card_types": [
          "production"
        ]
      },
      {
        "deck": "deck:phrases",
        "item": "sent:tatoeba-197249",
        "card_types": [
          "production"
        ]
      },
      {
        "deck": "deck:phrases",
        "item": "sent:tatoeba-190536",
        "card_types": [
          "production"
        ]
      },
      {
        "deck": "deck:phrases",
        "item": "sent:tatoeba-236798",
        "card_types": [
          "production"
        ]
      },
      {
        "deck": "deck:phrases",
        "item": "sent:tatoeba-9936514",
        "card_types": [
          "production"
        ]
      },
      {
        "deck": "deck:phrases",
        "item": "sent:tatoeba-179391",
        "card_types": [
          "production"
        ]
      }
    ]
  },
  "audio": "pending",
  "real_phrases": 6,
  "cumulative_known_vocab": 157,
  "layer": "C",
  "needs_review": true,
  "checkpoint": [
    {
      "id": "cf:n3:466:121",
      "type": "context_fill",
      "via": "phrase",
      "distractors": [
        "一番",
        "払う",
        "いい"
      ]
    },
    {
      "id": "cf:n3:267:896",
      "type": "context_fill",
      "via": "new-word",
      "distractors": [
        "問題",
        "座る",
        "来る"
      ]
    },
    {
      "id": "kr:n3:121",
      "type": "kanji_reading",
      "via": "new-word",
      "distractors": [
        "じかん",
        "しまる",
        "さかな"
      ]
    },
    {
      "id": "kr:n3:1312",
      "type": "kanji_reading",
      "via": "new-word",
      "distractors": [
        "きんがく",
        "ともだち",
        "すいどう"
      ]
    }
  ],
  "patterns_chunked": [
    "gram:gp-36",
    "gram:te-ita",
    "gram:n3-koto",
    "gram:n3-nado"
  ],
  "drills": [
    {
      "pattern": "gram:gp-149",
      "examples": [
        "sent:tatoeba-4856",
        "sent:tatoeba-83623",
        "sent:tatoeba-79091"
      ],
      "strand": "language-focused"
    },
    {
      "pattern": "gram:issho-ni",
      "examples": [
        "sent:tatoeba-774809",
        "sent:tatoeba-190532",
        "sent:tatoeba-190545"
      ],
      "strand": "language-focused"
    }
  ],
  "production": [
    {
      "prompt": {
        "pt-BR": "Fui tomar uma cerveja com uns amigos."
      },
      "answer_key": "私は友達とビールを飲みに行った。",
      "accepted_variants": [
        "わたしはともだちとびーるをのみにいった",
        "わたしはともだちとびーるをのみにいった。",
        "わたしわともだちとびーるをのみにいった",
        "わたしわともだちとびーるをのみにいった。",
        "私は友達とビールを飲みに行った",
        "私は友達とビールを飲みに行った。"
      ],
      "sentence": "sent:tatoeba-5329",
      "kind": "same-stage",
      "strand": "meaning-output"
    },
    {
      "prompt": {
        "pt-BR": "Será que existe mesmo cachorro que come peixe cru?"
      },
      "answer_key": "生の魚を食べる犬なんているのだろうか？",
      "accepted_variants": [
        "なまのさかなをたべるいぬなんているのだろうか",
        "なまのさかなをたべるいぬなんているのだろうか?",
        "生の魚を食べる犬なんているのだろうか",
        "生の魚を食べる犬なんているのだろうか?",
        "生の魚を食べる犬なんているのだろうか？"
      ],
      "sentence": "sent:tatoeba-412068",
      "kind": "same-stage",
      "strand": "meaning-output"
    },
    {
      "prompt": {
        "pt-BR": "Eu dei carne para o meu cachorro."
      },
      "answer_key": "私は犬に肉を与えた。",
      "accepted_variants": [
        "わたしはいぬににくをあたえた",
        "わたしはいぬににくをあたえた。",
        "わたしわいぬににくをあたえた",
        "わたしわいぬににくをあたえた。",
        "私は犬に肉を与えた",
        "私は犬に肉を与えた。"
      ],
      "sentence": "sent:tatoeba-157292",
      "kind": "same-stage",
      "strand": "meaning-output"
    }
  ],
  "fluency": {
    "prompt": {
      "pt-BR": "Você sentou num restaurante. Peça o que quer comer e beber, e diga se está bom."
    },
    "items": [
      "sent:tatoeba-185915",
      "sent:tatoeba-145934",
      "sent:tatoeba-204265",
      "sent:tatoeba-97583",
      "sent:tatoeba-200661",
      "sent:tatoeba-10899775"
    ],
    "seconds_target": 48,
    "zero_new_tokens": true,
    "kind": "situation",
    "strand": "fluency"
  },
  "strands": {
    "meaning-input": 26,
    "meaning-output": 6,
    "language-focused": 55,
    "fluency": 13
  },
  "strand_counts": {
    "meaning-input": 12,
    "meaning-output": 3,
    "language-focused": 26,
    "fluency": 6
  }
}
