{
  "id": "speak:eating-05",
  "schema_version": "1.0",
  "stage": "speak:eating",
  "order": 5,
  "title": {
    "pt-BR": "Comer e beber fora, parte 5"
  },
  "say_now": [
    "sent:tatoeba-145934",
    "sent:tatoeba-185915",
    "sent:tatoeba-224297",
    "sent:tatoeba-157292",
    "sent:tatoeba-412068",
    "sent:tatoeba-5329"
  ],
  "chunk_phrases": [],
  "untranslated": [],
  "words": [
    "vocab:1456360",
    "vocab:1607050",
    "vocab:1605820",
    "vocab:1258330",
    "vocab:1540170",
    "vocab:1544730",
    "vocab:1358340",
    "vocab:2796520",
    "vocab:1378450",
    "vocab:1055000"
  ],
  "patterns": [
    "gram:gp-149",
    "gram:gp-98",
    "gram:nagara",
    "gram:darou"
  ],
  "kanji_recognition": [
    "食",
    "読",
    "我",
    "魚",
    "生",
    "物"
  ],
  "shadowing": [
    "sent:tatoeba-145934",
    "sent:tatoeba-185915",
    "sent:tatoeba-224297",
    "sent:tatoeba-157292",
    "sent:tatoeba-412068",
    "sent:tatoeba-5329"
  ],
  "srs": {
    "introduces_cards": [
      {
        "deck": "deck:phrases",
        "item": "sent:tatoeba-145934",
        "card_types": [
          "production"
        ]
      },
      {
        "deck": "deck:phrases",
        "item": "sent:tatoeba-185915",
        "card_types": [
          "production"
        ]
      },
      {
        "deck": "deck:phrases",
        "item": "sent:tatoeba-224297",
        "card_types": [
          "production"
        ]
      },
      {
        "deck": "deck:phrases",
        "item": "sent:tatoeba-157292",
        "card_types": [
          "production"
        ]
      },
      {
        "deck": "deck:phrases",
        "item": "sent:tatoeba-412068",
        "card_types": [
          "production"
        ]
      },
      {
        "deck": "deck:phrases",
        "item": "sent:tatoeba-5329",
        "card_types": [
          "production"
        ]
      }
    ]
  },
  "audio": "pending",
  "real_phrases": 6,
  "cumulative_known_vocab": 145,
  "layer": "C",
  "needs_review": true,
  "checkpoint": [
    {
      "id": "so:n4:3429",
      "type": "sentence_order",
      "via": "phrase"
    },
    {
      "id": "cf:n4:3429:63",
      "type": "context_fill",
      "via": "phrase",
      "distractors": [
        "外",
        "間",
        "肉"
      ]
    },
    {
      "id": "cf:n3:318:42",
      "type": "context_fill",
      "via": "new-word",
      "distractors": [
        "貴方",
        "いい",
        "質問"
      ]
    },
    {
      "id": "kr:n3:1378",
      "type": "kanji_reading",
      "via": "new-word",
      "distractors": [
        "われわれ",
        "けっして",
        "しつもん"
      ]
    },
    {
      "id": "kr:n3:63",
      "type": "kanji_reading",
      "via": "new-word",
      "distractors": [
        "これ",
        "にち",
        "なま"
      ]
    }
  ],
  "patterns_chunked": [
    "gram:gp-110",
    "gram:gp-36"
  ],
  "drills": [
    {
      "pattern": "gram:gp-149",
      "examples": [
        "sent:tatoeba-4856",
        "sent:tatoeba-83623",
        "sent:tatoeba-79091"
      ],
      "strand": "language-focused"
    },
    {
      "pattern": "gram:gp-98",
      "examples": [
        "sent:gen-f4a52d78b938",
        "sent:gen-802fed6cb267",
        "sent:gen-023a4cdd4b1c"
      ],
      "strand": "language-focused"
    },
    {
      "pattern": "gram:nagara",
      "examples": [
        "sent:tatoeba-83210",
        "sent:tatoeba-11009755",
        "sent:tatoeba-226844"
      ],
      "strand": "language-focused"
    },
    {
      "pattern": "gram:darou",
      "examples": [
        "sent:tatoeba-80452",
        "sent:tatoeba-85312",
        "sent:tatoeba-84837"
      ],
      "strand": "language-focused"
    }
  ],
  "production": [
    {
      "prompt": {
        "pt-BR": "Comer tanto assim é anormal."
      },
      "answer_key": "そんなに食べるのは異常だ。",
      "accepted_variants": [
        "そんなにたべるのはいじょうだ",
        "そんなにたべるのはいじょうだ。",
        "そんなにたべるのわいじょうだ",
        "そんなにたべるのわいじょうだ。",
        "そんなに食べるのは異常だ",
        "そんなに食べるのは異常だ。"
      ],
      "sentence": "sent:tatoeba-204265",
      "kind": "same-stage",
      "strand": "meaning-output"
    },
    {
      "prompt": {
        "pt-BR": "Não come tanto assim!"
      },
      "answer_key": "そんなに食べないの！",
      "accepted_variants": [
        "そんなにたべないの",
        "そんなにたべないの!",
        "そんなに食べないの",
        "そんなに食べないの!",
        "そんなに食べないの！"
      ],
      "sentence": "sent:tatoeba-10657609",
      "kind": "same-stage",
      "strand": "meaning-output"
    },
    {
      "prompt": {
        "pt-BR": "Eles sentaram no fundo do restaurante."
      },
      "answer_key": "彼らはレストランの奥の方に座った。",
      "accepted_variants": [
        "かれらはれすとらんのおくのほうにすわった",
        "かれらはれすとらんのおくのほうにすわった。",
        "かれらわれすとらんのおくのほうにすわった",
        "かれらわれすとらんのおくのほうにすわった。",
        "彼らはレストランの奥の方に座った",
        "彼らはレストランの奥の方に座った。"
      ],
      "sentence": "sent:tatoeba-97583",
      "kind": "same-stage",
      "strand": "meaning-output"
    }
  ],
  "fluency": {
    "prompt": {
      "pt-BR": "Você sentou num restaurante. Peça o que quer comer e beber, e diga se está bom."
    },
    "items": [
      "sent:tatoeba-172639",
      "sent:tatoeba-171644",
      "sent:tatoeba-182254",
      "sent:tatoeba-13795168",
      "sent:tatoeba-226787",
      "sent:tatoeba-12890046"
    ],
    "seconds_target": 48,
    "zero_new_tokens": true,
    "kind": "situation",
    "strand": "fluency"
  },
  "strands": {
    "meaning-input": 24,
    "meaning-output": 6,
    "language-focused": 58,
    "fluency": 12
  },
  "strand_counts": {
    "meaning-input": 12,
    "meaning-output": 3,
    "language-focused": 29,
    "fluency": 6
  }
}
