{
  "id": "speak:arrival-02",
  "schema_version": "1.0",
  "stage": "speak:arrival",
  "order": 2,
  "title": {
    "pt-BR": "Chegar e cumprimentar, parte 2"
  },
  "say_now": [
    "sent:tatoeba-4971",
    "sent:tatoeba-219058",
    "sent:tatoeba-9840102",
    "sent:tatoeba-198378",
    "sent:tatoeba-78721",
    "sent:tatoeba-1874351"
  ],
  "chunk_phrases": [
    "sent:tatoeba-4971"
  ],
  "untranslated": [],
  "words": [
    "vocab:1311110",
    "vocab:1578850",
    "vocab:1547720",
    "vocab:1315920",
    "vocab:1529520",
    "vocab:1010080",
    "vocab:1605570",
    "vocab:1584930",
    "vocab:1586820"
  ],
  "patterns": [
    "gram:mashou",
    "gram:gp-17"
  ],
  "kanji_recognition": [
    "私",
    "雇",
    "行",
    "来",
    "間",
    "時"
  ],
  "shadowing": [
    "sent:tatoeba-4971",
    "sent:tatoeba-219058",
    "sent:tatoeba-9840102",
    "sent:tatoeba-198378",
    "sent:tatoeba-78721",
    "sent:tatoeba-1874351"
  ],
  "srs": {
    "introduces_cards": [
      {
        "deck": "deck:phrases",
        "item": "sent:tatoeba-4971",
        "card_types": [
          "production"
        ]
      },
      {
        "deck": "deck:phrases",
        "item": "sent:tatoeba-219058",
        "card_types": [
          "production"
        ]
      },
      {
        "deck": "deck:phrases",
        "item": "sent:tatoeba-9840102",
        "card_types": [
          "production"
        ]
      },
      {
        "deck": "deck:phrases",
        "item": "sent:tatoeba-198378",
        "card_types": [
          "production"
        ]
      },
      {
        "deck": "deck:phrases",
        "item": "sent:tatoeba-78721",
        "card_types": [
          "production"
        ]
      },
      {
        "deck": "deck:phrases",
        "item": "sent:tatoeba-1874351",
        "card_types": [
          "production"
        ]
      }
    ]
  },
  "audio": "pending",
  "real_phrases": 6,
  "cumulative_known_vocab": 9,
  "layer": "C",
  "needs_review": true,
  "checkpoint": [
    {
      "id": "so:n4:3348",
      "type": "sentence_order",
      "via": "phrase"
    },
    {
      "id": "cf:n4:3348:286",
      "type": "context_fill",
      "via": "phrase",
      "distractors": [
        "無い",
        "雇う",
        "行く"
      ]
    },
    {
      "id": "cf:n3:11:47",
      "type": "context_fill",
      "via": "new-word",
      "distractors": [
        "雇う",
        "時間",
        "はい"
      ]
    },
    {
      "id": "kr:n3:1396",
      "type": "kanji_reading",
      "via": "new-word",
      "distractors": [
        "やとう",
        "わたし",
        "あまり"
      ]
    },
    {
      "id": "kr:n3:35",
      "type": "kanji_reading",
      "via": "new-word",
      "distractors": [
        "わたし",
        "やとう",
        "じかん"
      ]
    }
  ],
  "patterns_chunked": [
    "gram:gp-108",
    "gram:amari-nai",
    "gram:n3-sei-de",
    "gram:nasai"
  ],
  "drills": [
    {
      "pattern": "gram:mashou",
      "examples": [
        "sent:tatoeba-139208",
        "sent:tatoeba-173392",
        "sent:tatoeba-197681"
      ],
      "strand": "language-focused"
    },
    {
      "pattern": "gram:gp-17",
      "examples": [
        "sent:tatoeba-124633",
        "sent:tatoeba-144227",
        "sent:tatoeba-80132"
      ],
      "strand": "language-focused"
    }
  ],
  "production": [
    {
      "prompt": {
        "pt-BR": "Bom dia!"
      },
      "answer_key": "おはようございます。",
      "accepted_variants": [
        "おはようございます",
        "おはようございます。"
      ],
      "sentence": "sent:tatoeba-335372",
      "kind": "same-stage",
      "strand": "meaning-output"
    },
    {
      "prompt": {
        "pt-BR": "Desculpe."
      },
      "answer_key": "すみません。",
      "accepted_variants": [
        "すみません",
        "すみません。"
      ],
      "sentence": "sent:tatoeba-408301",
      "kind": "same-stage",
      "strand": "meaning-output"
    },
    {
      "prompt": {
        "pt-BR": "Tchau!"
      },
      "answer_key": "さようなら！",
      "accepted_variants": [
        "さようなら",
        "さようなら!",
        "さようなら！"
      ],
      "sentence": "sent:tatoeba-426889",
      "kind": "same-stage",
      "strand": "meaning-output"
    }
  ],
  "fluency": {
    "prompt": {
      "pt-BR": "Você acabou de desembarcar. Cumprimente, agradeça e peça licença. Em voz alta, sem ler."
    },
    "items": [
      "sent:tatoeba-1532832",
      "sent:tatoeba-373351",
      "sent:tatoeba-1598216"
    ],
    "seconds_target": 24,
    "zero_new_tokens": true,
    "kind": "situation",
    "strand": "fluency"
  },
  "strands": {
    "meaning-input": 29,
    "meaning-output": 7,
    "language-focused": 57,
    "fluency": 7
  },
  "strand_counts": {
    "meaning-input": 12,
    "meaning-output": 3,
    "language-focused": 24,
    "fluency": 3
  }
}
