{
  "id": "speak:opinions-02",
  "schema_version": "1.0",
  "stage": "speak:opinions",
  "order": 2,
  "title": {
    "pt-BR": "Dizer o que você acha, parte 2"
  },
  "say_now": [
    "sent:tatoeba-211242",
    "sent:tatoeba-152088",
    "sent:tatoeba-81566",
    "sent:tatoeba-78959",
    "sent:tatoeba-162311",
    "sent:tatoeba-209394"
  ],
  "chunk_phrases": [],
  "untranslated": [],
  "words": [
    "vocab:1252090",
    "vocab:1359070",
    "vocab:1281000",
    "vocab:1394800",
    "vocab:1344970",
    "vocab:1264770",
    "vocab:1334210",
    "vocab:1476430"
  ],
  "patterns": [
    "gram:janai-dewa-nai",
    "gram:n3-to-shite",
    "gram:gp-89"
  ],
  "kanji_recognition": [
    "画",
    "計",
    "住",
    "対",
    "反",
    "民"
  ],
  "shadowing": [
    "sent:tatoeba-211242",
    "sent:tatoeba-152088",
    "sent:tatoeba-81566",
    "sent:tatoeba-78959",
    "sent:tatoeba-162311",
    "sent:tatoeba-209394"
  ],
  "srs": {
    "introduces_cards": [
      {
        "deck": "deck:phrases",
        "item": "sent:tatoeba-211242",
        "card_types": [
          "production"
        ]
      },
      {
        "deck": "deck:phrases",
        "item": "sent:tatoeba-152088",
        "card_types": [
          "production"
        ]
      },
      {
        "deck": "deck:phrases",
        "item": "sent:tatoeba-81566",
        "card_types": [
          "production"
        ]
      },
      {
        "deck": "deck:phrases",
        "item": "sent:tatoeba-78959",
        "card_types": [
          "production"
        ]
      },
      {
        "deck": "deck:phrases",
        "item": "sent:tatoeba-162311",
        "card_types": [
          "production"
        ]
      },
      {
        "deck": "deck:phrases",
        "item": "sent:tatoeba-209394",
        "card_types": [
          "production"
        ]
      }
    ]
  },
  "audio": "pending",
  "real_phrases": 6,
  "cumulative_known_vocab": 567,
  "layer": "C",
  "needs_review": true,
  "checkpoint": [
    {
      "id": "cf:n3:251:1082",
      "type": "context_fill",
      "via": "new-word",
      "distractors": [
        "中央",
        "乗る",
        "近く"
      ]
    },
    {
      "id": "cf:n3:704:136",
      "type": "context_fill",
      "via": "new-word",
      "distractors": [
        "決して",
        "尋ねる",
        "危ない"
      ]
    },
    {
      "id": "kr:n3:136",
      "type": "kanji_reading",
      "via": "new-word",
      "distractors": [
        "かんがえる",
        "りょうしん",
        "じゅうぶん"
      ]
    },
    {
      "id": "kr:n3:1648",
      "type": "kanji_reading",
      "via": "new-word",
      "distractors": [
        "もとめる",
        "ぜんたい",
        "しょさい"
      ]
    }
  ],
  "patterns_chunked": [
    "gram:n3-mattaku-nai",
    "gram:hazu-ga-nai",
    "gram:n3-nai-to"
  ],
  "drills": [
    {
      "pattern": "gram:janai-dewa-nai",
      "examples": [
        "sent:gen-c8e36c94f4e2",
        "sent:tatoeba-144679",
        "sent:tatoeba-536769"
      ],
      "strand": "language-focused"
    },
    {
      "pattern": "gram:n3-to-shite",
      "examples": [
        "sent:tatoeba-11977679",
        "sent:tatoeba-110065",
        "sent:tatoeba-110066"
      ],
      "strand": "language-focused"
    },
    {
      "pattern": "gram:gp-89",
      "examples": [
        "sent:tatoeba-144038",
        "sent:tatoeba-123036",
        "sent:tatoeba-10541587"
      ],
      "strand": "language-focused"
    }
  ],
  "production": [
    {
      "prompt": {
        "pt-BR": "Acho que ele não vem."
      },
      "answer_key": "彼は来ないと思います。",
      "accepted_variants": [
        "かれはこないとおもいます",
        "かれはこないとおもいます。",
        "かれわこないとおもいます",
        "かれわこないとおもいます。",
        "彼は来ないと思います",
        "彼は来ないと思います。"
      ],
      "sentence": "sent:tatoeba-78713",
      "kind": "same-stage",
      "strand": "meaning-output"
    },
    {
      "prompt": {
        "pt-BR": "Acho melhor assim."
      },
      "answer_key": "その方がいいと思う。",
      "accepted_variants": [
        "そのほうがいいとおもう",
        "そのほうがいいとおもう。",
        "その方がいいと思う",
        "その方がいいと思う。"
      ],
      "sentence": "sent:tatoeba-11870768",
      "kind": "same-stage",
      "strand": "meaning-output"
    },
    {
      "prompt": {
        "pt-BR": "Eu acho que sim."
      },
      "answer_key": "私はそう思います。",
      "accepted_variants": [
        "わたしはそうおもいます",
        "わたしはそうおもいます。",
        "わたしわそうおもいます",
        "わたしわそうおもいます。",
        "私はそう思います",
        "私はそう思います。"
      ],
      "sentence": "sent:tatoeba-160449",
      "kind": "same-stage",
      "strand": "meaning-output"
    }
  ],
  "fluency": {
    "prompt": {
      "pt-BR": "Perguntaram sua opinião. Diga o que você acha e por quê."
    },
    "items": [
      "sent:tatoeba-8724557",
      "sent:tatoeba-3583428",
      "sent:tatoeba-83404",
      "sent:tatoeba-149694",
      "sent:tatoeba-184096",
      "sent:tatoeba-124654"
    ],
    "seconds_target": 48,
    "zero_new_tokens": true,
    "kind": "situation",
    "strand": "fluency"
  },
  "strands": {
    "meaning-input": 27,
    "meaning-output": 7,
    "language-focused": 53,
    "fluency": 13
  },
  "strand_counts": {
    "meaning-input": 12,
    "meaning-output": 3,
    "language-focused": 24,
    "fluency": 6
  }
}
