{
  "id": "speak:opinions-05",
  "schema_version": "1.0",
  "stage": "speak:opinions",
  "order": 5,
  "title": {
    "pt-BR": "Dizer o que você acha, parte 5"
  },
  "say_now": [
    "sent:tatoeba-634127",
    "sent:tatoeba-219422",
    "sent:tatoeba-197441",
    "sent:tatoeba-179684",
    "sent:tatoeba-207696",
    "sent:tatoeba-212988"
  ],
  "chunk_phrases": [],
  "untranslated": [],
  "words": [
    "vocab:1551530",
    "vocab:1215790",
    "vocab:1346150",
    "vocab:1242970",
    "vocab:1436320",
    "vocab:1319750",
    "vocab:1157080",
    "vocab:1543000",
    "vocab:1312250"
  ],
  "patterns": [
    "gram:kamo-shirenai",
    "gram:koto-ni-naru",
    "gram:gp-73"
  ],
  "kanji_recognition": [
    "合",
    "算",
    "試",
    "場",
    "方",
    "予"
  ],
  "shadowing": [
    "sent:tatoeba-634127",
    "sent:tatoeba-219422",
    "sent:tatoeba-197441",
    "sent:tatoeba-179684",
    "sent:tatoeba-207696",
    "sent:tatoeba-212988"
  ],
  "srs": {
    "introduces_cards": [
      {
        "deck": "deck:phrases",
        "item": "sent:tatoeba-634127",
        "card_types": [
          "production"
        ]
      },
      {
        "deck": "deck:phrases",
        "item": "sent:tatoeba-219422",
        "card_types": [
          "production"
        ]
      },
      {
        "deck": "deck:phrases",
        "item": "sent:tatoeba-197441",
        "card_types": [
          "production"
        ]
      },
      {
        "deck": "deck:phrases",
        "item": "sent:tatoeba-179684",
        "card_types": [
          "production"
        ]
      },
      {
        "deck": "deck:phrases",
        "item": "sent:tatoeba-207696",
        "card_types": [
          "production"
        ]
      },
      {
        "deck": "deck:phrases",
        "item": "sent:tatoeba-212988",
        "card_types": [
          "production"
        ]
      }
    ]
  },
  "audio": "pending",
  "real_phrases": 6,
  "cumulative_known_vocab": 590,
  "layer": "C",
  "needs_review": true,
  "checkpoint": [
    {
      "id": "cf:n4:3764:1348",
      "type": "context_fill",
      "via": "phrase",
      "distractors": [
        "少ない",
        "手伝う",
        "ホテル"
      ]
    },
    {
      "id": "kr:n3:1268",
      "type": "kanji_reading",
      "via": "new-word",
      "distractors": [
        "どく",
        "もし",
        "せい"
      ]
    },
    {
      "id": "kr:n3:1348",
      "type": "kanji_reading",
      "via": "new-word",
      "distractors": [
        "もんだい",
        "あらわれ",
        "ステレオ"
      ]
    },
    {
      "id": "cf:n3:214:958",
      "type": "context_fill",
      "via": "review",
      "distractors": [
        "一寸",
        "趣味",
        "電車"
      ]
    }
  ],
  "patterns_chunked": [
    "gram:n3-sono-tame-ni",
    "gram:n3-ni-kanshite",
    "gram:n3-to-shitara"
  ],
  "drills": [
    {
      "pattern": "gram:kamo-shirenai",
      "examples": [
        "sent:tatoeba-2684823",
        "sent:tatoeba-152614",
        "sent:tatoeba-218082"
      ],
      "strand": "language-focused"
    },
    {
      "pattern": "gram:koto-ni-naru",
      "examples": [
        "sent:tatoeba-171197",
        "sent:tatoeba-10541587",
        "sent:tatoeba-8699443"
      ],
      "strand": "language-focused"
    },
    {
      "pattern": "gram:gp-73",
      "examples": [
        "sent:tatoeba-2171509",
        "sent:tatoeba-127272",
        "sent:tatoeba-11980988"
      ],
      "strand": "language-focused"
    }
  ],
  "production": [
    {
      "prompt": {
        "pt-BR": "É melhor você cumprir a promessa."
      },
      "answer_key": "約束は守った方がいい。",
      "accepted_variants": [
        "やくそくはまもったほうがいい",
        "やくそくはまもったほうがいい。",
        "やくそくわまもったほうがいい",
        "やくそくわまもったほうがいい。",
        "約束は守った方がいい",
        "約束は守った方がいい。"
      ],
      "sentence": "sent:tatoeba-79537",
      "kind": "same-stage",
      "strand": "meaning-output"
    },
    {
      "prompt": {
        "pt-BR": "Não há motivo nenhum para reclamar."
      },
      "answer_key": "不平を言う理由は何も無い。",
      "accepted_variants": [
        "ふへいをいうりゆうはなんもない",
        "ふへいをいうりゆうはなんもない。",
        "ふへいをいうりゆうわなんもない",
        "ふへいをいうりゆうわなんもない。",
        "不平を言う理由は何も無い",
        "不平を言う理由は何も無い。"
      ],
      "sentence": "sent:tatoeba-85041",
      "kind": "same-stage",
      "strand": "meaning-output"
    },
    {
      "prompt": {
        "pt-BR": "Não consigo compreender o motivo."
      },
      "answer_key": "理由がわかりかねます。",
      "accepted_variants": [
        "りゆうがわかりかねます",
        "りゆうがわかりかねます。",
        "理由がわかりかねます",
        "理由がわかりかねます。"
      ],
      "sentence": "sent:tatoeba-78366",
      "kind": "same-stage",
      "strand": "meaning-output"
    }
  ],
  "fluency": {
    "prompt": {
      "pt-BR": "Perguntaram sua opinião. Diga o que você acha e por quê."
    },
    "items": [
      "sent:tatoeba-153687",
      "sent:tatoeba-86311",
      "sent:tatoeba-80053",
      "sent:tatoeba-151044",
      "sent:tatoeba-5348453",
      "sent:tatoeba-119734"
    ],
    "seconds_target": 48,
    "zero_new_tokens": true,
    "kind": "situation",
    "strand": "fluency"
  },
  "strands": {
    "meaning-input": 26,
    "meaning-output": 7,
    "language-focused": 54,
    "fluency": 13
  },
  "strand_counts": {
    "meaning-input": 12,
    "meaning-output": 3,
    "language-focused": 25,
    "fluency": 6
  }
}
