{
  "id": "speak:about_you-02",
  "schema_version": "1.0",
  "stage": "speak:about_you",
  "order": 2,
  "title": {
    "pt-BR": "Falar de você, parte 2"
  },
  "say_now": [
    "sent:jec-0320",
    "sent:tatoeba-164979",
    "sent:tatoeba-1046077",
    "sent:tatoeba-84568",
    "sent:tatoeba-79312",
    "sent:tatoeba-9553773"
  ],
  "chunk_phrases": [],
  "untranslated": [],
  "words": [
    "vocab:1318610",
    "vocab:1487660",
    "vocab:1579260",
    "vocab:1001820",
    "vocab:1221270",
    "vocab:1156530",
    "vocab:1227560",
    "vocab:1010150",
    "vocab:1329000",
    "vocab:1612530"
  ],
  "patterns": [
    "gram:ta-bakari",
    "gram:n3-bakari",
    "gram:gp-8",
    "gram:kara"
  ],
  "kanji_recognition": [
    "意",
    "見",
    "言",
    "自",
    "生",
    "先"
  ],
  "shadowing": [
    "sent:jec-0320",
    "sent:tatoeba-164979",
    "sent:tatoeba-1046077",
    "sent:tatoeba-84568",
    "sent:tatoeba-79312",
    "sent:tatoeba-9553773"
  ],
  "srs": {
    "introduces_cards": [
      {
        "deck": "deck:phrases",
        "item": "sent:jec-0320",
        "card_types": [
          "production"
        ]
      },
      {
        "deck": "deck:phrases",
        "item": "sent:tatoeba-164979",
        "card_types": [
          "production"
        ]
      },
      {
        "deck": "deck:phrases",
        "item": "sent:tatoeba-1046077",
        "card_types": [
          "production"
        ]
      },
      {
        "deck": "deck:phrases",
        "item": "sent:tatoeba-84568",
        "card_types": [
          "production"
        ]
      },
      {
        "deck": "deck:phrases",
        "item": "sent:tatoeba-79312",
        "card_types": [
          "production"
        ]
      },
      {
        "deck": "deck:phrases",
        "item": "sent:tatoeba-9553773",
        "card_types": [
          "production"
        ]
      }
    ]
  },
  "audio": "pending",
  "real_phrases": 6,
  "cumulative_known_vocab": 301,
  "layer": "C",
  "needs_review": true,
  "checkpoint": [
    {
      "id": "cf:n3:777:102",
      "type": "context_fill",
      "via": "phrase",
      "distractors": [
        "去年",
        "生徒",
        "読む"
      ]
    },
    {
      "id": "cf:n3:132:706",
      "type": "context_fill",
      "via": "new-word",
      "distractors": [
        "休む",
        "自分",
        "会計"
      ]
    },
    {
      "id": "kr:n3:102",
      "type": "kanji_reading",
      "via": "new-word",
      "distractors": [
        "すべて",
        "かぞく",
        "できる"
      ]
    },
    {
      "id": "kr:n3:146",
      "type": "kanji_reading",
      "via": "new-word",
      "distractors": [
        "ほしい",
        "きのう",
        "さかな"
      ]
    }
  ],
  "patterns_chunked": [
    "gram:ga-hitsuyou",
    "gram:n3-kiri"
  ],
  "drills": [
    {
      "pattern": "gram:ta-bakari",
      "examples": [
        "sent:tatoeba-11009581",
        "sent:tatoeba-9722237",
        "sent:tatoeba-159565"
      ],
      "strand": "language-focused"
    },
    {
      "pattern": "gram:n3-bakari",
      "examples": [
        "sent:tatoeba-147558",
        "sent:tatoeba-88247",
        "sent:tatoeba-96219"
      ],
      "strand": "language-focused"
    },
    {
      "pattern": "gram:gp-8",
      "examples": [
        "sent:tatoeba-5320",
        "sent:tatoeba-176635",
        "sent:tatoeba-150175"
      ],
      "strand": "language-focused"
    },
    {
      "pattern": "gram:kara",
      "examples": [
        "sent:tatoeba-76156",
        "sent:tatoeba-4772",
        "sent:gen-671b7aebf53d"
      ],
      "strand": "language-focused"
    }
  ],
  "production": [
    {
      "prompt": {
        "pt-BR": "Eu gosto de comida japonesa."
      },
      "answer_key": "私は日本の料理が好きです。",
      "accepted_variants": [
        "わたしはにっぽんのりょうりがすきです",
        "わたしはにっぽんのりょうりがすきです。",
        "わたしわにっぽんのりょうりがすきです",
        "わたしわにっぽんのりょうりがすきです。",
        "私は日本の料理が好きです",
        "私は日本の料理が好きです。"
      ],
      "sentence": "sent:tatoeba-154700",
      "kind": "same-stage",
      "strand": "meaning-output"
    },
    {
      "prompt": {
        "pt-BR": "De onde você é?"
      },
      "answer_key": "ご出身はどちらですか。",
      "accepted_variants": [
        "ごしゅっしんはどちらですか",
        "ごしゅっしんはどちらですか。",
        "ごしゅっしんわどちらですか",
        "ごしゅっしんわどちらですか。",
        "ご出身はどちらですか",
        "ご出身はどちらですか。"
      ],
      "sentence": "sent:tatoeba-5060",
      "kind": "same-stage",
      "strand": "meaning-output"
    },
    {
      "prompt": {
        "pt-BR": "Eu moro no interior."
      },
      "answer_key": "田舎に住んでいます。",
      "accepted_variants": [
        "いなかにすんでいます",
        "いなかにすんでいます。",
        "田舎に住んでいます",
        "田舎に住んでいます。"
      ],
      "sentence": "sent:tatoeba-124907",
      "kind": "same-stage",
      "strand": "meaning-output"
    }
  ],
  "fluency": {
    "prompt": {
      "pt-BR": "Alguém puxou assunto com você. Diga quem você é, de onde vem e do que gosta."
    },
    "items": [
      "sent:tatoeba-227125",
      "sent:tatoeba-101820",
      "sent:tatoeba-77964",
      "sent:tatoeba-121988",
      "sent:tatoeba-4562257",
      "sent:tatoeba-126245"
    ],
    "seconds_target": 48,
    "zero_new_tokens": true,
    "kind": "situation",
    "strand": "fluency"
  },
  "strands": {
    "meaning-input": 24,
    "meaning-output": 6,
    "language-focused": 57,
    "fluency": 12
  },
  "strand_counts": {
    "meaning-input": 12,
    "meaning-output": 3,
    "language-focused": 28,
    "fluency": 6
  }
}
